{
  "track_id": "e2e_testing_20260126",
  "type": "feature",
  "status": "new",
  "created_at": "2026-01-26T12:00:00Z",
  "updated_at": "2026-01-26T12:00:00Z",
  "description": "A Dashboard UI, az MCP Szerver és az integrált eszközök (Google Workspace, Scheduler) együttes működésének automatizált ellenőrzése."
}