{
  "track_id": "open_interpreter_integration_20260120",
  "type": "feature",
  "status": "archived",
  "created_at": "2026-01-20T10:00:00Z",
  "updated_at": "2026-02-05T01:50:00Z",
  "archived_at": "2026-02-05T01:50:00Z",
  "archive_reason": "Stale - no progress for 16 days",
  "description": "Open Interpreter integráció a Python futtatáshoz"
}
