{
  "track_id": "bas_comprehensive_test_protocol_20260210",
  "title": "BAS Átfogó Tesztprotokol",
  "description": "Teljes rendszer tesztprotokol: Health Check, Phoenix Crash Recovery, Ügynök Delegálás, Dashboard Error Boundary, Robotkéz Szinttesztek, CI/CD Automatizáció (Husky + Nightly E2E). 6 fázis, ~16 óra, ~30 új teszt fájl.",
  "type": "infrastructure",
  "priority": "CRITICAL",
  "status": "in_progress",
  "spec_status": "frozen",
  "spec_approved_at": "2026-02-10T18:00:00Z",
  "spec_approved_by": "Copilot",
  "implementation_allowed": true,
  "created_at": "2026-02-10T18:00:00Z",
  "updated_at": "2026-02-16T15:05:00Z",
  "assigned_agent": "DeveloperAgent",
  "progress": 90,
  "dependencies": [
    "code_quality_improvements_20260210",
    "dashboard_test_suite_20260210"
  ],
  "tags": [
    "testing",
    "infrastructure",
    "ci-cd",
    "phoenix",
    "health-check",
    "husky",
    "resilience"
  ]
}
